{
  "surface": "cli_agent_wait",
  "tool": "codex",
  "event": "rendered",
  "duration_bucket": "10-30s",
  "terminal_interactive": true,
  "ci": false,
  "country": "PT",
  "code_uploaded": false,
  "prompt_uploaded": false,
  "logs_uploaded": false,
  "visible_seconds": 0,
  "install_id_hash": "<sha256-install-id>",
  "session_id": "<opaque-session-id>",
  "placement_id": "<opaque-placement-id>",
  "campaign_id": "<opaque-campaign-id>",
  "cli_version": "0.x",
  "signature": "<opaque-event-token>"
}
